{
  "schema_version": "dramago.media-execution-link/v1",
  "execution_id": "execution_example",
  "execution_intent": {
    "schema_version": "dramago.execution-intent/v1",
    "workspace_id": "ws_example",
    "project_id": "project_example",
    "generation_attempt": 1,
    "request_key": "fixture-only-original-submit-key",
    "request_key_version": "dramago/v1",
    "operation": "generate_image",
    "target_ref": {
      "artifact_id": "art_image_plan",
      "version_id": "av_image_plan_1",
      "content_digest": "sha256:4cfb5b98e5b4ef629fd1681f0d6a8cf08336aafcbe08118a5d78080e3050e79c"
    },
    "script_baseline_id": "sb_ep01",
    "script_baseline_ref": {
      "artifact_id": "art_script_baseline",
      "version_id": "av_script_baseline_1",
      "content_digest": "sha256:34202e3d7865bfe66d1b80d64b45fa22a30bad127f7d00df28f5f25cd7b9df90"
    },
    "production_plan_ref": {
      "artifact_id": "art_image_plan",
      "version_id": "av_image_plan_1",
      "content_digest": "sha256:4cfb5b98e5b4ef629fd1681f0d6a8cf08336aafcbe08118a5d78080e3050e79c"
    },
    "workbench_revision": "fixture-only-original-revision",
    "public_model_id": "fixture-only-model"
  },
  "intent_digest": "sha256:7c3101188afdaa6f6671efc49b8b15532dbe8114c7dbfd5bb8828249bbc3e66a",
  "quote_id": "quote_example",
  "media_job_id": "job_example",
  "media_asset_ids": [
    "asset_example"
  ],
  "budget_authorization_ref": {
    "artifact_id": "art_budget_receipt",
    "version_id": "av_budget_receipt_1",
    "content_digest": "sha256:43f602ea8bceffe9a37d2bf9a552a816ea426c43bd204f0f344ccbd2e952d165"
  },
  "created_at": "2026-01-01T00:00:00Z"
}
